"247";"Herbst";"Snerbst Plushies";"https://www.instagram.com/snerbstplushies/";"Plushies (Custom and premade), plush keychains/charms, fursuit plush props";"X";"X";"X";"";"";;;;;;;;;;;;;;;;;
"248";"rmdragons";"Rocky Mountain Dragons LLC";"http://www.rmdragons.com";"We sell custom shoulder packs, wearable art dolls, and plushies";"X";"X";"X";"";"";;;;;;;;;;;;;;;;;
"250";"RSKemono";"Rising Sun Kemono";"http://www.RSKemono.com";"We make Japanese Kemono Style Fursuits";"X";"X";"X";"";"";;;;;;;;;;;;;;;;;
"251";"TokoKami";"TokoKami";"https://sta.sh/2fjboge0iu3?edit=1";"Prints of var. sizes, Postcards, Stickers, ACEO Cards, Buttons, Onsite Commissions, Badge Comissions, Originals";"X";"X";"X";"";"";;;;;;;;;;;;;;;;;
"252";"NORR";"Muura & NORR";"https://www.furaffinity.net/user/norrthehungerer/";"limited edition lino prints, pins, textile merch, small ceramics";"X";"X";"X";"";"";;;;;;;;;;;;;;;;;
"253";"muura";"muura";"http://muura.tumblr.com";"pins, enamel pins, stickers, graphic art prints, zines, commissions";"X";"X";"X";"";"";;;;;;;;;;;;;;;;;
"254";"Staphilea";"PlushiesRain";"https://www.deviantart.com/staphilea";"Plush, patch and keychain";"X";"X";"X";"";"";;;;;;;;;;;;;;;;;
"255";"Leundra";"Leundra";"https://www.deviantart.com/leundra";"prints, suit parts, pendants, original art";"X";"X";"X";"";"";;;;;;;;;;;;;;;;;
"256";"zhenya";"zhenya";"https://zuckerluchs.de/gallery/";"commissions, prints, stickers";"X";"X";"X";"";"";;;;;;;;;;;;;;;;;
"257";"Rez";"Mountain Badger";"https://mtnbadger.com";"T-shirts, underwear, prints, and stickers";"X";"X";"X";"";"";;;;;;;;;;;;;;;;;
"258";"Cruz";"Cruz";"https://www.weasyl.com/~cruz";"Buttons, Posters, Tote Bags";"X";"X";"X";"";"";;;;;;;;;;;;;;;;;
"259";"Emithegoat";"Emi The Goat";"https://www.furaffinity.net/user/sugaryviolet/";"Badges, prints, pins, mugs, commissions";"X";"X";"X";"";"";;;;;;;;;;;;;;;;;
"260";"Gideon";"";"http://www.gideonscorral.com";"art, sketchbook sketches, sketches, merchandize, art dvds, and much more";"X";"X";"X";"";"";;;;;;;;;;;;;;;;;
"262";"Wishkamon";"Traffic Cone Creations";"https://m.facebook.com/TrafficConeCreations";"I want to offer custom Kigurumi/hoodie slots as well as some premades and possibly fursuit props";"X";"X";"X";"";"";;;;;;;;;;;;;;;;;
"264";"Jyanon";"Jyanon";"https://www.furaffinity.net/user/jyanon/";"Fursuit Photographie and Convention Project Management";"X";"X";"X";"";"";;;;;;;;;;;;;;;;;
