"119";"Miles-DF";"Miles-DF";"https://twitter.com/miles_df";"Books, prints, commissions.";"X";"X";"X";"";"";;;;;;;;;;;;;;;;;
"120";"Tollwut";"";"https://www.amazon.de/Enyanische-Erkenntnis-Darnell-Tollwut-ebook/dp/B071GLJ5XQ/ref=sr_1_1?__mk_de_DE=%C3%85M%C3%85%C5%BD%C3%95%C3%91&keywords=Enyanische+erkenntnis&qid=1576843829&sr=8-1";"Bücher (Print sowie E-Book), Hörbuch und ggf. Poster und/oder Lesezeichen; Books (Print and E-Book), audiobook and possibly Poster and/or Bookmark";"X";"X";"X";"";"";;;;;;;;;;;;;;;;;
"121";"Dktorzi";"Dktorzi";"https://inkbunny.net/DoctorZi";"Prints, Mousepads, T-shirts, Pillows, Books.";"X";"X";"X";"";"";;;;;;;;;;;;;;;;;
"122";"Rin the Dragon";"";"";"Custom and 100+ different pre-printed Badge Ribbons. Coffee likeur.";"X";"X";"X";"";"";;;;;;;;;;;;;;;;;
"123";"Yulynh";"Yulynh";"http://www.furaffinity.net/user/adlynh/";"Prints, engraved wood, keychains, paintings, badges commissions";"X";"X";"X";"";"X";;;;;;;;;;;;;;;;;
"124";"Nerumi";"Nerumi Plushies";"https://drive.google.com/open?id=1IYg5BU3lBxR7ncwXrZP6GBgWwBcGOthA";"Custom plushies, props, fursuit accesories and soon my own printed designed products (backpacks, pencil cases, bandanas)";"X";"X";"X";"";"";"I'm a plush artist originally from Argentina, but living in Czech Republic.

In my shop you will find lots of collars, plush props, bandanas, and more accessories!

I also make custom plushies, feel free to inquiry ♥";"";"";"https://www.etsy.com/shop/NerumiPlushies";"@pancakelulu";"";"Pancake Lulu#3069";"Plush props, collars, bandanas & more! /NerumiPlushies @ Etsy/FA/FB .Contact @pancakelulu on Telegram/Twitter for custom plush inquiries ♥";"";"";"";"X";"";"";"";"";"X"
"125";"Morg";"Morg";"http://www.naughtymorg.com";"Comics, Prints and Commissions!";"X";"X";"X";"";"";;;;;;;;;;;;;;;;;
"126";"SpittyArtz";"";"https://www.deviantart.com/spittyartz";"badge commissions, custom painted figures made by me, buttons, prints, charms";"X";"X";"X";"";"";;;;;;;;;;;;;;;;;
"127";"FreesTyler";"";"http://www.furaffinity.net/user/freestyler";"Art commissions";"X";"X";"X";"";"";;;;;;;;;;;;;;;;;
"128";"Swarthylacine";"Tapapat Creations";"https://tapapatcreations.com/";"OOAK fursuit premade(s), OOAK fursuit parts (handpaws, tails), fursuit accessories (balaclava, belts), character designs, badges";"X";"X";"X";"";"";;;;;;;;;;;;;;;;;
"129";"V";"V-Art";"http://etsy.com/uk/shop/WerewolfVDesigns";"V-Art Clothing: Hats, T-Shirts, etc.";"X";"X";"X";"";"";"Hello! I'm V, based in the UK I run V-Art which is an online Furry apparel and merch store. :D";"";"";"http://etsy.com/uk/shop/WerewolfVDesigns";"@Werewolf_V";"";"";"Furry apparel! With free worldwide shipping!";"";"";"";"X";"";"";"";"";"X"
"130";"Faolan";"Faolan";"http://www.blackwolfjewellery.nl";"gemstone jewellery: pendants, earrings, necklaces, and single sample rocks.";"X";"X";"X";"";"";;;;;;;;;;;;;;;;;
"131";"Yulliandress";"Yulliandress";"http://www.furaffinity.net/user/yulliandress/";"books, prints, commissions.";"X";"X";"X";"";"";;;;;;;;;;;;;;;;;
"132";"Kael";"Kael Tiger";"http://www.furaffinity.net/user/kaeltiger/";"Acrylic Standees, badges, prints, comics, gaming cards, lanyards, shirts, commissions";"X";"X";"X";"";"";;;;;;;;;;;;;;;;;
"133";"drangir";"";"https://www.furaffinity.net/user/ikar/";"Commissions on site, prints, art related gadgets/accessories";"X";"X";"X";"";"";;;;;;;;;;;;;;;;;
"134";"Licantrox";"Rogue Fang";"http://Roguefang.com";"Furry apparel, drawings and merch.";"X";"X";"X";"";"";;;;;;;;;;;;;;;;;
"135";"Keidran";"";"";"Mugs, Cotton shopping bags, Sticker, Buttons and T-Shirts";"X";"X";"X";"";"";"I work together with several artists to bring you cute art on cotton bags, acrylic charms and other things!";"";"";"https://www.etsy.com/shop/TheAbyssShop";"@TheAbyssShop";"";"Katojana#9183";"Cute acrylic charms, stickers and more of cute animals!";"";"";"";"X";"";"";"";"";"X"
"136";"Red-IzaK";"Red-IzaK";"https://www.furaffinity.net/user/red-izak/";"prints, canvas prints, wall scrolls, commissions";"X";"X";"X";"";"";;;;;;;;;;;;;;;;;
"137";"baLOrKIn";"";"https://www.furaffinity.net/user/balorkin/";"Pride merch, Buttons, charms, pins, art prints & mouse mats";"X";"X";"X";"";"";;;;;;;;;;;;;;;;;
"138";"zmprl";"Naughty Wolf";"https://www.naughtywolftoys.com";"Naughty toys, paddles, dildos etc";"X";"X";"X";"";"X";;;;;;;;;;;;;;;;;
"139";"whire";"Made by Whire";"https://www.madebywhire.com/";"Patches, Plushies, Fursuit Supplies";"X";"X";"X";"";"";;;;;;;;;;;;;;;;;
"140";"Imanika";"Imanika";"https://www.furaffinity.net/user/imanika/";"Prints, postcards, keychains, plush tails, ears, small plush toys, hand made stuff, artbooks, commissions";"X";"X";"X";"";"";;;;;;;;;;;;;;;;;
"141";"Winters Howling";"Winters Howling";"https://www.wintershowling.com/";"Fursuit Partials, Fursuit Commissions, Props, Fursuit Accessories, Fursuit Sprays";"X";"X";"X";"";"";;;;;;;;;;;;;;;;;
"142";"Berneri";"Berneri";"https://twitter.com/BerneriART/media and https://twitter.com/koirakoirana";"Charms, enamel pins, cards, lanyards, magnets, stickers, commissions";"X";"X";"X";"";"";"Bern here! I'm Finnish media content designer and artist. I inhale my inspiration for my art from nature, creatures and animals. I love to play with colors and different kind of shapes and patterns. These things can be seen in my home as well in a form of a miniature jungle (I love plants too much), two cats, aquarium and some pet beetles.";"";"";"http://berneri.storenvy.com/";"@BerneriART";"";"Berneri#6969";"Creatures, nature themes and unique art with plenty of styles! You can contact me via Telegram @Berneri or Twitter @BerneriART";"";"";"";"X";"";"";"";"";"X"
"143";"Sekares Arisawa";"Sekares Arisawa";"https://www.deviantart.com/sekares-arisawa";"prints, shirts, badge commissions, pins and buttons";"X";"X";"X";"";"";;;;;;;;;;;;;;;;;
"144";"Animas Animus";"";"https://mobile.twitter.com/animas_animus";"Prints different sizes, small goods like mugs mousepads sticker, commissions";"X";"X";"X";"";"X";;;;;;;;;;;;;;;;;
"145";"RaptorsDen";"Raptors Den";"https://www.etsy.com/shop/TheRaptorsShop";"Fursuit Parts, Fursuit commissions, Art Sell, badge, prints,";"X";"X";"X";"";"";"Working with cosplay crafting, fursuit making, art doll making.
Not long ago we developed a new way of creating Vader-San's synth species
as a new type of cosplay/suit, synthsuit, dunno if this is the right word
though :D
If you interested we made a video on youtube from the first mini partial;
https://www.youtube.com/watch?v=xextOTlmIi8";"";"";"https://www.facebook.com/RaptorsDenSculpts";"https://twitter.com/RaptorsDen";"";"Arthenion#9672";"Synth suits, Fursuits, Artdolls - twitter.com/RaptorsDen";"";"";"";"X";"";"";"";"";"X"
"146";"Merion";"Merionic";"http://www.instagram.com/merionicfigures/";"One-of-a-kind sculptures, resin figurines, original drawings";"X";"X";"X";"";"";;;;;;;;;;;;;;;;;
"147";"WhiteLeonard";"WhiteLeonard";"https://twitter.com/snowrealm https://www.furaffinity.net/user/whiteleonard";"Commission artwork, T-shirts, merchandise, posters, art-books and comics";"X";"X";"X";"";"";;;;;;;;;;;;;;;;;
"149";"RedCoatCat";"RedCoatCat";"http://www.furaffinity.net/user/redcoatcat/";"Anthro Comics both PG and adult rated.  Limited /unlimited Prints both loose and matted in two different sizes. Magnets, stickers, lanyards, coasters, card decks, heraldry themed species badges and mugs.  I have two sizes of commissions I offer at conventions only finished at the con.  Here is a link to my display last year I have more products available now. http://redcoatcat.com/stuff/ef2019.jpg";"X";"X";"X";"";"";;;;;;;;;;;;;;;;;
"150";"Kiko";"Kikonine";"https://twitter.com/KikonineArt";"Prints, Stickers, Lanyards/Wristbands, Commissions";"X";"X";"X";"";"";;;;;;;;;;;;;;;;;
"151";"Mystifur";"Mystic-Creatures";"http://Mystic-Creatures.com";"Fursuits and Parts, Undersuits, Fursuit Accessoires, Live Sewing";"X";"X";"X";"";"";;;;;;;;;;;;;;;;;
"152";"niku30";"Niku30";"https://www.artstation.com/niku30 , https://www.instagram.com/Niku30__/ (good example of anthro artwork)";"Undecided. Prints perhaps, digital commissions, keychains, can draw human and anthro";"X";"X";"X";"";"";;;;;;;;;;;;;;;;;
"153";"camaro cougar";"CandyPaws";"http://candypaws.webs.com";"Fursuit Sprays";"X";"X";"X";"";"";;;;;;;;;;;;;;;;;
"154";"Renn";"Renn";"http://beasthorizon.com";"Custom fursuits, 3D printed bases and parts, 3D printed skulls, T-shirts, stickers.";"X";"X";"X";"";"";;;;;;;;;;;;;;;;;
"155";"Alastair Wildifre";"Alastair Wildfire";"https://www.alastairwildfire.com/illustration.html";"Originals, commissions, prints, batches, stickers, pins, buttons.";"X";"X";"X";"";"";;;;;;;;;;;;;;;;;
"156";"Franko";"Franko's Artshop";"http://www.furaffinity.net/user/negger";"Prints, Franko graphic novels, commissions";"X";"X";"X";"";"";;;;;;;;;;;;;;;;;
"157";"ShinigamiGirl";"";"https://www.furaffinity.net/user/shinigamigirl/";"at con commissions, loose and matted prints, enamel pins, acrylic charms, vinyl stickers";"X";"X";"X";"";"";;;;;;;;;;;;;;;;;
"158";"mag";"mag ferret";"http://twitter.com/magferret";"shirts, hats, stickers, buttons, prints and commissions";"X";"X";"X";"";"";;;;;;;;;;;;;;;;;
"159";"Fox Amoore";"Fox Amoore";"";"CDs and LPs";"X";"X";"X";"";"";;;;;;;;;;;;;;;;;
"160";"AlectorFencer";"AlectorFencer";"http://www.yriachronicles.com";"Books, Prints";"X";"X";"X";"";"";;;;;;;;;;;;;;;;;
"161";"kenket";"kenket";"https://twitter.com/tessgarman";"Art prints, posters, originals, sketchbooks, stickers, keychains, STUFF and THINGS.";"X";"X";"X";"";"";;;;;;;;;;;;;;;;;
"162";"wylfi";"";"https://www.instagram.com/wylfi/";"prints, comics, pins, keychains, stickers, commissions";"X";"X";"X";"";"";;;;;;;;;;;;;;;;;
"164";"xtorbenx";"Artworktee";"http://www.furaffinity.net/user/fur-n-prints/ http://artworktee.com";"A wide Variety of Sublimation Printed, Textile, Metal,glass and ceramic, Merch. Tshirts and mystery boxes";"X";"X";"X";"";"";;;;;;;;;;;;;;;;;
"165";"Awoonews";"Awoonews";"http://awoonews.com";"We run a furry news website, AwooNews.com, and would like to attend the event to get the word out about it. We will have a few items for sale but our primary objective is to find new writers and to let people know about our site.";"X";"X";"X";"";"";;;;;;;;;;;;;;;;;
"166";"Ganryu";"GanryuSasaki";"https://www.furaffinity.net/gallery/ganryu/";"prints (A4, postcards, 148x148mm), artbooklets, buttons (pre made and as commission), stickersheet, drawing commissions";"X";"X";"X";"";"";;;;;;;;;;;;;;;;;
"167";"Mipsy";"Furry Tailor";"http://Www.furrytailor.co.uk";"Fursuit hand paws,  tails,  feet paws,  maybe a partial or two,  squishies with hair";"X";"X";"X";"";"";;;;;;;;;;;;;;;;;
"168";"sasharjones";"";"http://sasharjones.com";"Originals, Prints, Playmats, Mousepads.";"X";"X";"X";"";"";;;;;;;;;;;;;;;;;
"169";"Sternengaukler";"Birb Brothers (Sternengaukler + Federkeks)";"http://www.furaffinity.net/user/ylangylang/";"Pill Lottery (no blanks), Originals, Prints, On Spot Commissions, Keychains, Magnets and much more :)";"X";"X";"X";"";"";;;;;;;;;;;;;;;;;
"170";"Federkeks";"Birb Brothers (Sternengaukler + Federkeks)";"https://www.furaffinity.net/user/federkeks/";"Prints, traditional artworks, on spot commissions, comics and more";"X";"X";"X";"";"";;;;;;;;;;;;;;;;;
"171";"Scale";"#TeamItalia";"http://alessioscalerandi.com";"Commissions, originals, prints and illustrated books.";"X";"X";"X";"";"";;;;;;;;;;;;;;;;;
"172";"Vinaru";"Vinaru";"http://www.furaffinity.net/user/vinaru/";"Commissions, Prints, Sticker";"X";"X";"";"";"";;;;;;;;;;;;;;;;;
"173";"Sanssouci";"#TeamItalia";"https://www.furaffinity.net/user/sanssouci/";"Commissions, prints, postcards";"X";"X";"X";"";"";;;;;;;;;;;;;;;;;
"174";"Buxbi";"Buxbi";"";"prints, acrylic charms + standies + pins, book";"X";"X";"X";"";"";;;;;;;;;;;;;;;;;
"175";"ti-killa";"";"https://www.instagram.com/killingtea/?hl=de";"commissions,pins, buttons, scarfs/bandannas, postcards,stickers, other printed/crafted items, maybe mugs and originals";"X";"X";"X";"";"";;;;;;;;;;;;;;;;;
"176";"Kanrei";"Kitty Fluff";"https://www.furaffinity.net/gallery/kanrei/";"badge commissions, blankets, bath towels, faux fur, keychain, tails, mug, stickers, dakimakura";"X";"X";"X";"";"";;;;;;;;;;;;;;;;;
"177";"Tanngrisnir";"Tanngrisnir";"http://www.furaffinity.net/gallery/tanngrisnir/";"Prints, stickers, enamel pins, digital commissions, acrylic charms, makeup bags, mousepads";"X";"X";"X";"";"";;;;;;;;;;;;;;;;;
"178";"Riffuchs";"Riffuchs' Honey";"";"Honey, Mead, Bee Wax Products";"X";"X";"X";"";"";;;;;;;;;;;;;;;;;
"180";"thelivingshadow";"The Living Shadow";"http://www.furaffinity.net/user/thelivingshadow/";"prints, stickers, zines and commissions such as: badges, sketches, ref sheets, illustrations";"X";"X";"X";"";"";"I'm a freelance artist from Toronto,Canada and I like working on fantasy/sci-fi themed art as well as slice-of-life themed art too! I'll be offering commissions of all kinds such as paintings, illustrations, sketches, badges and ref sheets this month as well as selling prints as well! 

For more information about what kind of prints I have for sale feel to browse though my FA gallery

and my commission prices can be found here:
https://twitter.com/SanthanVutha/status/1289675885868486656";"";"";"http://www.furaffinity.net/user/thelivingshadow/";"@SanthanVutha";"";"Santhan#3128";"I'm offering commissions of all kinds this month! https://twitter.com/SanthanVutha/status/1289675885868486656";"";"";"";"X";"";"";"";"";"X"
"181";"MouthMutt";"MouthMutt";"https://mouthmonsterstudio.wixsite.com/mouthmutt";"Prints, stickers, charms, pins, commissions and crafts";"X";"X";"X";"";"";;;;;;;;;;;;;;;;;
"182";"Neotheta";"Neotheta";"https://neotheta.fi";"Printed merch, t-shirts, pillowcases, playmats, bags, charms";"X";"X";"X";"";"";;;;;;;;;;;;;;;;;
"183";"Anatoliba";"";"http://anatoliba.deviantart.com/";"sketch/pencil commissions, badge commissions, stickers etc.";"X";"X";"X";"";"";;;;;;;;;;;;;;;;;
"184";"Meoxie";"Rat & Pupz";"https://twitter.com/Meoxie";"Commissions, goodies, prints, etc";"X";"X";"X";"";"";;;;;;;;;;;;;;;;;
"185";"Doggy";"Rat & Pupz";"https://www.etsy.com/shop/SadRatProd";"Fursuit sprays & soaps";"X";"X";"X";"";"";;;;;;;;;;;;;;;;;
"186";"Bean";"Rat & Pupz";"https://www.deviantart.com/lordmarlon";"Commissions & goodies";"X";"X";"X";"";"";;;;;;;;;;;;;;;;;
"187";"velkss";"";"https://www.deviantart.com/velkss/gallery/";"Sketch commissions, bracelets,pins,stickers,prints, t-shirts and charms";"X";"X";"X";"";"";;;;;;;;;;;;;;;;;
"188";"Llew";"#TeamItalia";"http://www.furaffinity.net/user/aurllew";"Illustrated books";"X";"X";"X";"";"";;;;;;;;;;;;;;;;;
"189";"yowulf";"Naomi Romero Art";"http://naomiromero.carbonmade.com";"Prints, enamel pins, stickers, charms, small plush toys";"X";"X";"X";"";"";;;;;;;;;;;;;;;;;
"190";"Waffles";"Waffle Wishes";"https://dakimakuradreams.com/";"Prints, Wallscrolls, Blankets, Playmats, Mousepads, Pillowcases, Shirts, Pants, and Art Books.";"X";"X";"X";"";"";;;;;;;;;;;;;;;;;
"191";"KaotikJuju";"KaotikJuju";"http://www.furaffinity.net/user/kaotikjuju/";"commissions, badge commissions,custom note book, stickers, bookmark, prints";"X";"X";"X";"";"";;;;;;;;;;;;;;;;;
"192";"Nomax";"";"https://www.furaffinity.net/user/nomax/";"Prints mainly, with some other merch secondarily (stickers, bookmarks etc.)";"X";"X";"X";"";"";;;;;;;;;;;;;;;;;
"193";"Avalon";"Fluffcreation “Avalon Blueavian”";"http://www.fluffcreation.com";"Fursuit headbags, Fursuit Supplies, Fursuit repair, Merchandise, maybe Pawpets and Kigus.";"X";"X";"X";"";"";;;;;;;;;;;;;;;;;
"194";"Ryuko";"RyukoArt";"http://www.furaffinity.net/user/ryuko/";"I'm planning to sell bodypillow covers, stickers, sketch commissions, prints and other merchnd other small similar products";"X";"X";"X";"";"";;;;;;;;;;;;;;;;;
"195";"iPoke";"";"http://www.furaffinity.net/user/ipoke/";"Prints (artwork and comics), commissions (badges and other)";"X";"X";"";"";"X";;;;;;;;;;;;;;;;;
"196";"Revaivwra";"Revaivwra";"";"My own comic books, funny prints, postcards, pins all in a cartoony and funny look as well as commissions on con";"X";"X";"X";"";"";;;;;;;;;;;;;;;;;
"197";"herpydragon";"Herpydragon";"https://www.furaffinity.net/gallery/herpydragon/";"Stickers, prints, commissions, postcards, buttons, posters";"X";"X";"X";"";"";;;;;;;;;;;;;;;;;
"198";"tabalon";"Lokyr Mead";"http://lokyr.com";"Bottled mead, furry merchandise, custom prints";"X";"X";"X";"";"";;;;;;;;;;;;;;;;;
"199";"Twice";"Twice";"http://www.furaffinity.net/user/twice/";"Commissions, originals, prints, kitchen towels, bags, sketchbooks";"X";"X";"X";"";"";;;;;;;;;;;;;;;;;
"200";"Virensere";"";"http://www.furaffinity.net/user/virensere/";"Resin creations (charms, figures, dice, magnets), Prints and stickers, on-site commissions";"X";"X";"X";"";"";;;;;;;;;;;;;;;;;
"201";"Eroskun";"Eroskunlove";"https://www.furaffinity.net/user/eroskun/";"Erotic drawings, stickers and dakimakuras";"X";"X";"X";"";"X";"Hey!! im a gay furry and bara NSFW artist!! (only +18 allowed, not teens please!)
be welcome and have fun with my big muscles!! :D";"";"";"https://www.furaffinity.net/user/eroskun/";"https://twitter.com/eroskunlove";"";"eroskun #9857";"for commission fill my form: https://forms.gle/zshobDnGbBUBjaMR9";"";"";"";"X";"";"";"";"";"X"
"202";"Echoes Above";"Tillivision";"";"Vinyl Stickers and on-demand badge printing";"X";"X";"X";"";"";;;;;;;;;;;;;;;;;
"203";"phallybro";"Phallybro";"http://www.furaffinity.net/user/phallusbro/, https://twitter.com/phallusbro";"Commissions, prints, art book/zine";"";"X";"X";"";"";;;;;;;;;;;;;;;;;
"204";"gamibri";"gamibri";"http://gamibri.com";"Posters, prints, badges and sketchs!";"X";"X";"X";"";"";;;;;;;;;;;;;;;;;
"205";"chubby-shark";"";"http://www.furaffinity.net/gallery/chubby-shark/";"Traditional commissions, comic books, prints, postcards, charms and pins.";"X";"X";"X";"";"";;;;;;;;;;;;;;;;;
"206";"Zeor Karethran";"Zeor's PlushiePalace";"";"Plushies, stuffed animals, squeakers";"X";"X";"X";"";"";;;;;;;;;;;;;;;;;
"207";"laser";"";"http://furaffinity.net/user/laser";"prints, stickers, shirts";"X";"X";"X";"";"";"Adult digital illustrations. Mainly equine, and beefy on top of that.";"";"";"http://furaffinity.net/user/laser";"laserpaints";"";"Real Human Bean#0001";"Breaking News: Big lewd hoers sighted @laserpaints";"";"";"";"X";"";"";"";"";"X"
"208";"Ludger";"Fabulous Fantasies";"";"silicone sex toys (dildos, sheaths and balls)";"X";"X";"X";"";"X";;;;;;;;;;;;;;;;;
"209";"EosFoxx";"EosFoxx";"http://Eosfoxx.de";"Prints, mugs, shirts and more";"X";"X";"X";"";"";;;;;;;;;;;;;;;;;
"210";"Imiak";"";"http://www.imiakart.com";"presentation of a furry videogame project (https://presscattocontinue.itch.io/first-harvest), artwork prints, merchandise, sketch commissions";"X";"X";"X";"";"";;;;;;;;;;;;;;;;;
"211";"Fleeks";"Art of Fleeks";"http://fleeks.art";"Sketches, Art Prints, Buttons, Pins, Chili Sauce, Shirts, Jewelry, Door Signs, Shiny Stuff, Free Cookies";"X";"X";"X";"";"";"I am an LGTBQIA+ friendly German Artist specialized on vintage and modern vector designs and colorful experimental artworks. I love to design sleek merchandise. I have an artistic bias for dragons, birds, kobolds, cats and sharks, but I am not afraid of any species. I am also crazy for hot sauces!

I am open for exclusive EF ONLINE commissions!";"";"";"http://fleeks.art";"featherfleeks";"";"Sputtelspecht#7847";"Fleeks is a Euro Artist specialized in vintage and modern vector designs, colorful experimental artworks, and merchandise. Twitter: @Featherfleeks";"";"";"";"X";"";"";"";"";"X"
"212";"jonathanvair";"Jonathan Vair Duncan / Stigmata";"https://www.furaffinity.net/gallery/stigmata/";"Prints, playmats, mousepads, and art books";"X";"X";"X";"";"";;;;;;;;;;;;;;;;;
"213";"Djigr";"";"http://djigr.deviantart.com";"(badge) commissions, furry and dinosaur merchandise";"X";"X";"X";"";"";;;;;;;;;;;;;;;;;
"214";"LiLaiRa";"LiLaiRa";"http://lilaira.deviantart.com";"Stickers, Magnets, Prints, Artbooks, Enamel pins, Soaps";"X";"X";"X";"";"";;;;;;;;;;;;;;;;;
"215";"Dolphiana";"";"http://www.furaffinity.net/user/dolphiana/";"Prints, sketches, traditional artwork, magnets, commissions";"X";"X";"X";"";"";;;;;;;;;;;;;;;;;
"216";"Grimm";"GrimmDrawn";"http://www.furaffinity.net/user/grandtaurus/";"artwork/prints/posters, commissions, playmats, cards, tshirts";"X";"X";"X";"";"";;;;;;;;;;;;;;;;;
"217";"Pan Hesekiel Shiroi";"Pan Heskiel Shiroi";"http://pan-hesekiel-shiroi.de";"sketch and badge commissions, prints, matted and double matted prints, concept art, official Pawpet Show posters, Paws'n'Claws card decks";"X";"X";"X";"";"";;;;;;;;;;;;;;;;;
"218";"Dragarta";"";"http://www.dragarta.com";"Dragon Calendars 2021, prints, bookmarks, buttons, cosmetic bags, stickers and other";"X";"X";"X";"";"";;;;;;;;;;;;;;;;;
"219";"Jojo-Tiger";"Urban Fursuit Originals";"";"buttons, fursuit parts, resin trinkets, prints";"X";"X";"X";"";"";;;;;;;;;;;;;;;;;
"221";"Dinski";"";"http://Dinski.carrd.co";"Fursuit: pre-made handpaws, feetpaws, tails, small parts; merchandise: Keychains, stickers, pins, prints, etc. ; art: quick badge commissions (done at con), sketch commissions (done at con), digital homework commissions";"X";"X";"X";"";"";;;;;;;;;;;;;;;;;
"222";"heyriel";"";"http://heyriel.deviantart.com/";"Prints of digital art, traditional media originals and sketch commissions";"X";"X";"X";"";"";;;;;;;;;;;;;;;;;
"223";"tanutanuki";"tanutanuki";"http://www.furaffinity.net/user/tanutanuki/";"pencil sketch commissions, badge commissions, traditional art originals, prints, prints on canvas, stickers,polymer clay figurines, plush fursuit accessories";"X";"X";"X";"";"";;;;;;;;;;;;;;;;;
"224";"mur der wolf";"Murderwolf's Hoard";"";"Animal inspired rings,necklaces, bracelets, pins, cheap badges and keychains";"X";"X";"X";"";"";;;;;;;;;;;;;;;;;
"225";"scritt";"Twin Tail Creations";"https://twintailcreations.com/";"Silicone Adult Toys, Accessories";"X";"X";"X";"";"X";;;;;;;;;;;;;;;;;
"226";"Honey";"Alpha Dogs";"";"Ita-mal backpacks, merchandise such as stickers, pins, fursuit items";"X";"X";"X";"";"";;;;;;;;;;;;;;;;;
"227";"ellie";"Eli Spencer";"http://elispencer.com";"shirts, prints, charms, commissions, zines/books!";"X";"X";"X";"";"";;;;;;;;;;;;;;;;;
"228";"Calimdor";"Calimdor";"http://www.calimdor.de";"Sketches, Badge Commissions, Traditional Art, Communication of digital drawings for after the con";"X";"X";"X";"";"";;;;;;;;;;;;;;;;;
"229";"sophie";"Sophie Robin";"http://sophierobin.com";"gentle puppy tshirts, dragon zines, stickers, prints, Animal charms, commissions";"X";"X";"X";"";"";;;;;;;;;;;;;;;;;
"230";"anoroth";"";"https://www.furaffinity.net/user/anoroth/";"I'd like to sell all kinds of prints, stickers, badge and sketch commissions and some print-related merch";"X";"X";"X";"";"";;;;;;;;;;;;;;;;;
"231";"Rox goupil";"";"http://www.furaffinity.net/user/-rox-/";"Prints and traditional commissions";"X";"X";"X";"";"";;;;;;;;;;;;;;;;;
"232";"PapayaBadger";"Papaya Badger";"http://Papayabadger.com";"Badge commissions, light up keychains and bracelets, bluetooth name badges and collars, tote bags, blankets, face masks, enamel pins";"X";"X";"X";"";"";;;;;;;;;;;;;;;;;
"233";"Blajn";"Blajnart";"https://www.furaffinity.net/user/gryph000/";"Prints/canvass prints, pins/buttons, mugs,traditional pencil art, original arts, commission sketches,laminated badges, magnets.";"X";"X";"X";"";"";;;;;;;;;;;;;;;;;
"234";"Luki Saluki";"Dog In Disguise";"https://rytteremilie.wixsite.com/emilycreative";"Primarily vinyl stickers. Both premade as different paw prints and furry words such as ""OWO"", But also custom vinyl stickers such as your characters name. It will be printed on the convention on the vinyl cutter.";"X";"X";"X";"";"";;;;;;;;;;;;;;;;;
"235";"Ruef";"Ruef n' Beeb";"http://ruefnbeeb.com";"We sell T-shirts, body pillows, drawstring bags, mousepad, lanyards, enamel pins, stickers, buttons and Live Traditional and Digital commissions!";"X";"X";"X";"";"";;;;;;;;;;;;;;;;;
"236";"Divided";"Divided";"https://www.weasyl.com/submissions/divided";"badge comissions, handmade leathercraft (writbands, collars, keychains...), prints";"X";"X";"X";"";"";;;;;;;;;;;;;;;;;
"237";"Velannal";"Velannal";"https://www.furaffinity.net/user/velannal/";"Prints, small comic, stickers, t-shirts, resin bookmarks";"X";"X";"X";"";"";;;;;;;;;;;;;;;;;
"238";"crowfangs";"";"http://crowfangs.com";"Pins, prints, embroidered patches, stickers, commissions";"X";"X";"X";"";"";;;;;;;;;;;;;;;;;
"239";"Gnulia";"";"http://www.juliabeutling.com";"prints, posters, postcards, small books, sketch commissions";"X";"X";"X";"";"";;;;;;;;;;;;;;;;;
"240";"EmilyCreative";"EmilyCreative";"https://rytteremilie.wixsite.com/emilycreative";"Commissions, stickers, Keychains, mugs and vinyl sticker designs.";"X";"X";"X";"";"";;;;;;;;;;;;;;;;;
"241";"datsasu";"dat sazu";"https://www.instagram.com/datsazu/ or https://t.me/sazuart (telegram chanel)";"Original artworks, prints and badges";"X";"X";"X";"";"";;;;;;;;;;;;;;;;;
"242";"SolarByte";"SolarByte";"http://www.furaffinity.net/gallery/solarbyte/";"Badges, pins, lanyard, prints, buttons";"X";"X";"X";"";"";;;;;;;;;;;;;;;;;
"243";"Toxikaiju";"TOXIKAIJU";"http://Furaffinity.net/user/toxicclaws";"Prints, badges, charms, drawings, stickers";"X";"X";"X";"";"";;;;;;;;;;;;;;;;;
"244";"CRP";"";"http://crp.parafin.sk/ creepyriver.deviantart.com";"Handmade leather items (belts, handbags, wallets, bracelets, small leather accessories,...); Fimo brooches and necklaces; buttons.";"X";"X";"X";"";"";;;;;;;;;;;;;;;;;
"245";"FrauLion";"HyenaAgenda";"https://hyena-agenda.com/";"Apparel and accessories for your inner hyena!";"X";"X";"X";"";"";;;;;;;;;;;;;;;;;
"246";"pinkferal";"pinkferal";"https://twitter.com/PinkFeral";"Plushies, toys, stickers, enamel pins, mouse pads, sketches, t shirts and posters";"X";"X";"X";"";"";;;;;;;;;;;;;;;;;
